{
  "$schema": "http://json-schema.org/draft-07/schema#",
  "title": "Base Administrative Entity",
  "type": "object",
  "required": ["type", "name", "valid_from"],
  "properties": {
    "type": {
      "type": "string",
      "description": "Entity type: country, state, province, county, district, etc."
    },
    "name": {
      "type": "object",
      "description": "Multilingual canonical name",
      "required": ["en", "fr"],
      "additionalProperties": {
        "type": "string"
      }
    },
    "alternate_names": {
      "type": "array",
      "items": { "type": "string" },
      "description": "uncategorized alternate names"
    },
    "valid_from": {
      "type": ["string", "null"],
      "format": "date"
    },
    "valid_to": {
      "type": ["string", "null"],
      "format": "date"
    },
    "change_notes": {
      "type": "object",
      "properties": {
        "en": { "type": "string" },
        "fr": { "type": "string" }
      },
      "additionalProperties": false
    },
    "meta": {
      "type": "object"
    }
  },
  "additionalProperties": false
}
