{
  "type": "country",
  "name": {
    "en": "Chile",
    "fr": "Chili (le)"
  },
  "alternate_names": [
    "Chile",
    "Chili (le)",
    "Chile"
  ],
  "meta": {
    "iso_3166_1_alpha2": "CL",
    "iso_3166_1_alpha3": "CHL",
    "iso_3166_1_numeric": "152",
    "iso_path": "/content/iso/code/3166/CL_82.xml"
  },
  "valid_from": null
}