{
  "type": "country",
  "name": {
    "en": "Gabon",
    "fr": "Gabon (le)"
  },
  "alternate_names": [
    "Gabon",
    "Gabon (le)"
  ],
  "meta": {
    "iso_3166_1_alpha2": "GA",
    "iso_3166_1_alpha3": "GAB",
    "iso_3166_1_numeric": "266",
    "iso_path": "/content/iso/code/3166/GA_82.xml"
  },
  "valid_from": null
}