{
  "type": "country",
  "name": {
    "en": "Madagascar",
    "fr": "Madagascar"
  },
  "alternate_names": [
    "Madagascar",
    "Madagascar",
    "Madagasikara"
  ],
  "meta": {
    "iso_3166_1_alpha2": "MG",
    "iso_3166_1_alpha3": "MDG",
    "iso_3166_1_numeric": "450",
    "iso_path": "/content/iso/code/3166/MG_82.xml"
  },
  "valid_from": null
}