{
  "type": "country",
  "name": {
    "en": "Italy",
    "fr": "Italie (l')"
  },
  "alternate_names": [
    "Italy",
    "Italie (l')",
    "Italia (l')"
  ],
  "meta": {
    "iso_3166_1_alpha2": "IT",
    "iso_3166_1_alpha3": "ITA",
    "iso_3166_1_numeric": "380",
    "iso_path": "/content/iso/code/3166/IT_82.xml"
  },
  "valid_from": null
}